{
  "schema_version": "entity-registry-v1",
  "chapter_id": "JIUCHUI:CH014",
  "protagonist_id": "PROTAGONIST_001",
  "entities": [
    {
      "entity_id": "CHAR_PARTNER_001",
      "kind": "character",
      "display_name": "少东家",
      "aliases": [],
      "authority_refs": [
        "authority.entity.CHAR_PARTNER_001"
      ],
      "parent_entity_id": ""
    },
    {
      "entity_id": "CHAR_RIVAL_001",
      "kind": "character",
      "display_name": "阮青蜃",
      "aliases": [],
      "authority_refs": [
        "authority.entity.CHAR_RIVAL_001"
      ],
      "parent_entity_id": ""
    },
    {
      "entity_id": "EVENT_NEXT_TIDE_001",
      "kind": "event",
      "display_name": "下一次十二日地潮",
      "aliases": [],
      "authority_refs": [
        "authority.entity.EVENT_NEXT_TIDE_001"
      ],
      "parent_entity_id": ""
    },
    {
      "entity_id": "ITEM_RETURN_TIDE_WEDGE_001",
      "kind": "item",
      "display_name": "回潮楔",
      "aliases": [
        "楔子",
        "古器"
      ],
      "authority_refs": [
        "authority.entity.ITEM_RETURN_TIDE_WEDGE_001"
      ],
      "parent_entity_id": ""
    },
    {
      "entity_id": "LOCATION_OLD_PASS_001",
      "kind": "location",
      "display_name": "旧关",
      "aliases": [],
      "authority_refs": [
        "authority.entity.LOCATION_OLD_PASS_001"
      ],
      "parent_entity_id": ""
    },
    {
      "entity_id": "ORG_HUNDRED_FURNACE_001",
      "kind": "organization",
      "display_name": "百炉会",
      "aliases": [],
      "authority_refs": [
        "authority.entity.ORG_HUNDRED_FURNACE_001"
      ],
      "parent_entity_id": ""
    },
    {
      "entity_id": "PROTAGONIST_001",
      "kind": "character",
      "display_name": "顾停舟",
      "aliases": [
        "他",
        "本体",
        "主角"
      ],
      "authority_refs": [
        "canon.protagonist"
      ],
      "parent_entity_id": ""
    },
    {
      "entity_id": "RESOURCE_PERSONAL_MINING_SHARE_001",
      "kind": "resource",
      "display_name": "个人矿利",
      "aliases": [
        "矿利份额"
      ],
      "authority_refs": [
        "authority.entity.RESOURCE_PERSONAL_MINING_SHARE_001"
      ],
      "parent_entity_id": ""
    },
    {
      "entity_id": "ROUTE_GRAIN_001",
      "kind": "route",
      "display_name": "粮路",
      "aliases": [
        "粮道"
      ],
      "authority_refs": [
        "authority.entity.ROUTE_GRAIN_001"
      ],
      "parent_entity_id": ""
    }
  ]
}
